company_name,website,email,industry,country,description
CJDropshipping,https://cjdropshipping.com,cj@cjdropshipping.com,dropshipping,CN,World's largest dropshipping fulfillment platform from China
DSers,https://dsers.com,support@dsers.com,dropshipping,CN,Official AliExpress dropshipping partner app for Shopify
Wiio Dropshipping,https://wiio.io,support@wiio.io,dropshipping,CN,China-based dropshipping supplier and fulfillment
DropSure,https://dropsure.com,info@dropsure.com,dropshipping,CN,China dropshipping supplier with global fulfillment
EPROLO,https://eprolo.com,admin@eprolo.com,dropshipping,CN,Free dropshipping platform with China sourcing
HyperSKU,https://hypersku.com,info@hypersku.com,dropshipping,CN,Cross-border dropshipping and private label from China
Sup Dropshipping,https://supdropshipping.com,support@supdropshipping.com,dropshipping,CN,China dropshipping agent and fulfillment service
KakaClo,https://kakaclo.com,bd@kakaclo.com,dropshipping,CN,China fashion dropshipping B2B platform
Nihao Dropshipping,https://nihaodropshipping.com,support@nihaodropshipping.com,dropshipping,CN,China wholesale and dropshipping supplier
Trendsi,https://trendsi.com,hello@trendsi.com,dropshipping,CN,Fashion dropshipping from China to US
Printify,https://printify.com,support@printify.com,dropshipping,CN,Print-on-demand with Chinese production partners
Sellvia,https://sellvia.com,hello@sellvia.com,dropshipping,US_CN,Dropshipping platform connecting China suppliers to US
Yakkyofy,https://yakkyofy.com,info@yakkyofy.com,dropshipping,CN,China dropshipping with automated customs handling
Dropified,https://dropified.com,support@dropified.com,dropshipping,CN,Dropshipping automation with China suppliers
AppScenic,https://appscenic.com,hello@appscenic.com,dropshipping,CN,Dropshipping marketplace with EU/US delivery from China
DHgate,https://dhgate.com,partnerships@dhgate.com,marketplace_b2b,CN,China B2B cross-border marketplace 30M+ products
Banggood,https://banggood.com,bd@banggood.com,marketplace_b2b,CN,Global online shopping with direct China shipping
LightInTheBox,https://lightinthebox.com,partnerships@lightinthebox.com,marketplace_b2b,CN,China cross-border ecommerce to 200+ countries
Made-in-China,https://made-in-china.com,service@made-in-china.com,marketplace_b2b,CN,China B2B manufacturing sourcing platform
Global Sources,https://globalsources.com,partnerships@globalsources.com,marketplace_b2b,HK_CN,Hong Kong based China sourcing B2B platform
1688.com,https://1688.com,partner@1688.com,marketplace_b2b,CN,Alibaba's China domestic wholesale B2B platform
Joom,https://joom.com,partners@joom.com,marketplace_b2b,LV_CN,European marketplace shipping from China
Wish,https://wish.com,merchant@wish.com,marketplace_b2b,US_CN,US marketplace with majority China merchant base
Club Factory,https://clubfactory.com,bd@clubfactory.com,marketplace_b2b,CN,India-focused marketplace with China sourcing
LightSpeed Commerce,https://lscommerce.cn,info@lscommerce.cn,marketplace_b2b,CN,China cross-border commerce platform
4PX Express,https://4px.com,service@4px.com,logistics,CN,China's largest cross-border logistics operator
YunExpress,https://yunexpress.com,service@yunexpress.com,logistics,CN,China cross-border ecommerce logistics specialist
SFC Service,https://sfcservice.com,info@sfcservice.com,logistics,CN,China fulfillment and cross-border shipping
CNE Express,https://cne.com,service@cne.com,logistics,CN,China to worldwide cross-border express
Yanwen Logistics,https://yanwen.com,partnerships@yanwen.com,logistics,CN,China domestic and international logistics
Winit Logistics,https://winit.com.cn,bd@winit.com.cn,logistics,CN,China overseas warehouse and cross-border logistics
iMile Delivery,https://imile.com,bd@imile.com,logistics,AE_CN,China-backed MENA delivery platform
EWE Express,https://ewelogistic.com,bd@ewelogistic.com,logistics,CN,Southeast Asia cross-border logistics from China
UTL Express,https://utlexpress.cn,info@utlexpress.cn,logistics,CN,China international express and customs clearance
ZTO Express International,https://zto.com,intl@zto.com,logistics,CN,China's ZTO Express international shipping arm
YTO Express International,https://yto.net.cn,intl@yto.net.cn,logistics,CN,China's YTO Express international operations
SF Express International,https://sf-express.com,intl@sf-express.com,logistics,CN,China's SF Express international division
BEST Inc International,https://best-inc.com,intl@best-inc.com,logistics,CN,China logistics platform with international ops
Deppon International,https://deppon.com,intl@deppon.com,logistics,CN,China Deppon logistics international arm
GreenTech Logistics,https://greentechintl.com,info@greentechintl.com,logistics,CN,China cross-border parcel and freight
PostPanda,https://postpanda.com,bd@postpanda.com,logistics,CN,China cross-border parcel service platform
TS Express,https://tsexpress.cn,bd@tsexpress.cn,logistics,CN,China to US/EU cross-border express specialist
Aplus Express,https://aplusexpress.com,info@aplusexpress.com,logistics,CN,China cross-border small parcel specialist
Dship China,https://dship.cn,info@dship.cn,logistics,CN,China dropshipping focused shipping service
ParcelX,https://parcelx.com,info@parcelx.com,logistics,HK,Hong Kong cross-border ecommerce logistics
Qiankun Express,https://qiankunexpress.com,info@qiankunexpress.com,logistics,CN,China international logistics for ecommerce
NovaTech Shipping,https://novatechshipping.com,info@novatechshipping.com,logistics,CN,China cross-border shipping technology
WeShip,https://weship.cn,bd@weship.cn,logistics,CN,China ecommerce international shipping platform
Ewe Freight,https://eweinternational.com,freight@eweinternational.com,logistics,CN,China international freight forwarder for ecommerce
PingPong Payments,https://pingpongx.com,bd@pingpongx.com,payment,CN,China cross-border payment for ecommerce sellers
Lianlian International,https://lianlianpay.com,intl@lianlianpay.com,payment,CN,China cross-border payment platform
XTransfer,https://xtransfer.com,bd@xtransfer.com,payment,CN,China B2B cross-border payment platform
SUNRATE,https://sunrate.com,bd@sunrate.com,payment,SG_CN,Cross-border payment infrastructure Asia
OnerWay,https://onerway.com,bd@onerway.com,payment,CN,China cross-border acquiring and payment
iPayLinks,https://ipaylinks.com,bd@ipaylinks.com,payment,CN,China cross-border payment solution provider
Skyee,https://skyee.com,bd@skyee.com,payment,CN,China cross-border collections for ecommerce
Bolero Finance,https://bolero.finance,info@bolero.finance,payment,CN,Cross-border payment and FX for Chinese exporters
Dowsure,https://dowsure.com,bd@dowsure.com,payment,CN,China cross-border ecommerce payment insurance
Huanle Pay,https://huanlepay.com,bd@huanlepay.com,payment,CN,Cross-border payment platform for Chinese sellers
cGate,https://cgate.io,info@cgate.io,payment,CN,China cross-border payment gateway for global ecom
Shopline,https://shopline.com,partnerships@shopline.com,saas,HK_CN,Cross-border ecommerce platform Asia
Shoplazza,https://shoplazza.com,bd@shoplazza.com,saas,CN,China cross-border DTC store builder
ShopBase,https://shopbase.com,hello@shopbase.com,saas,VN_CN,Cross-border ecommerce platform with China sourcing
SHOPEX,https://shopex.cn,bd@shopex.cn,saas,CN,China B2C cross-border ecommerce SaaS
EasyStore,https://easystore.co,partnerships@easystore.co,saas,MY_CN,Southeast Asia ecommerce platform China-connected
SocialPeta,https://socialpeta.com,bd@socialpeta.com,saas,CN,Cross-border ecommerce ad intelligence platform
GoodsFox,https://goodsfox.com,bd@goodsfox.com,saas,CN,Cross-border ecommerce product research tool
FindNiche,https://findniche.com,support@findniche.com,saas,CN,Niche product finder for cross-border dropshipping
EcomHunt,https://ecomhunt.com,info@ecomhunt.com,saas,IL_CN,Dropshipping winning product research tool
Sell The Trend,https://sellthetrend.com,info@sellthetrend.com,saas,CN,AI-powered dropshipping product research
BigSpy,https://bigspy.com,contact@bigspy.com,saas,CN,Cross-border ecommerce ad spy tool
AdSpy,https://adspy.com,info@adspy.com,saas,UK_CN,Global ad intelligence for ecommerce
Koala Inspector,https://koalainspector.com,info@koalainspector.com,saas,CN,Shopify competitor research for cross-border
NicheDropshipping,https://nichedropshipping.com,info@nichedropshipping.com,saas,CN,China product sourcing and private label agent
Sourcify,https://sourcify.com,info@sourcify.com,saas,US_CN,China manufacturing sourcing platform
Jungle Scout China,https://junglescout.com,china@junglescout.com,saas,CN,Amazon seller tool China office
Helium 10 China,https://helium10.com,china@helium10.com,saas,CN,Amazon optimization tool China team
AMZScout,https://amzscout.net,info@amzscout.net,saas,CN,Amazon product research for Chinese sellers
Pacvue China,https://pacvue.com,china@pacvue.com,saas,CN,Retail media management China office
Teikametrics China,https://teikametrics.com,china@teikametrics.com,saas,CN,AI retail optimization China team
ChannelAdvisor China,https://channeladvisor.com,china@channeladvisor.com,saas,CN,Multichannel commerce China operations
GeekSeller,https://geekseller.com,support@geekseller.com,saas,CN,Walmart and Amazon multichannel management
Listing Mirror,https://listingmirror.com,info@listingmirror.com,saas,CN,Multichannel listing management cross-border
DHL eCommerce China,https://dhl.com/cn,cn.ecommerce@dhl.com,logistics_enterprise,CN,DHL China ecommerce cross-border solutions
FedEx China,https://fedex.com/cn,china.ecommerce@fedex.com,logistics_enterprise,CN,FedEx China cross-border ecommerce logistics
UPS China,https://ups.com/cn,china.solutions@ups.com,logistics_enterprise,CN,UPS China cross-border solutions
Cainiao Network,https://cainiao.com,partner@cainiao.com,logistics_enterprise,CN,Alibaba logistics network global operations
JD Logistics International,https://jdl.com,intl_bd@jdl.com,logistics_enterprise,CN,JD.com logistics international division
China Post EMS,https://ems.com.cn,intl_bd@chinapost.com.cn,logistics_enterprise,CN,China Post international express mail service
SF International,https://sf-international.com,partnerships@sf-international.com,logistics_enterprise,CN,SF Express international operations HQ
Zonos China,https://zonos.com,china@zonos.com,customs,CN,US cross-border duty platform China office
Global-e China,https://global-e.com,china@global-e.com,customs,CN,Cross-border commerce platform China team
Flow Commerce China,https://flow.io,china@flow.io,customs,CN,Global ecommerce compliance China office
AEB China,https://aeb.com,china@aeb.com,customs,DE_CN,Trade compliance software China operations
TradeEasy,https://tradeeasy.com.hk,info@tradeeasy.com.hk,customs,HK,Hong Kong trade compliance and customs platform
ChinaImEx,https://chinaimex.com,info@chinaimex.com,customs,CN,China import/export customs automation
SureDone China,https://suredone.com,china@suredone.com,customs,CN,Multichannel product data and customs
Customs City China,https://customscity.com,china@customscity.com,customs,US_CN,Digital customs brokerage China team
